rating,date,variation,verified_reviews,feedback,processed_reviews
5,30-Jul-18,Black  Show,"""I love the Echo Show!! I have the dot and have been using that for the last 6 months,  but the Show is so much better.  The sound quality is amazing and the screen resolution is like watching a mini 4K tv.  I love being able to see my timers, events and list instead of having them read to me.  I purchased this on prime day, and it is worth every penny.  When the dot was given to me, I thought """"this is a cute novelty,  but I'll probably never use it"""". Was I wrong!!  Echo is part of my daily routine,  and has made my life so much easier.""",1.0,love echo show dot use last month show much better sound qualiti amaz screen resolut like watch mini k tv love abl see timer event list instead read purchas prime day worth everi penni dot given thought cute novelti ill probabl never use wrong echo part daili routin made life much easier
5,30-Jul-18,Black  Show,"""So far I’m very pleased with my Echo Show.  The problem is, there’s so much it can do that I haven’t been able to explore the extent of its abilities! I got the special price as part of the Prime Day promotion...and you just can’t beat what you get for the price.  Very pleased with the sound. The video screen is sharp. Sometimes it takes a few tries to get Alexa to perform a command...but as I get to know the system better, I’m hoping that will improve.  One drawback in the music...I’ve noticed a lot of the songs from years past, are re-recordings by the original artist...but not the original recording itself.  Example: Secret Agent Man by Johnny Rivers...a “live”version is used, not the original version.  If I’m going to pay for Prime Music...I’d like to hear the original version of songs...not later recordings.  Or at least give me a choice of what I want to hear.  Otherwise, I am very pleased with my Echo Show.  So pleased in fact, that I bought a second one!""",1.0,far im pleas echo show problem there much havent abl explor extent abil got special price part prime day promotionand cant beat get price pleas sound video screen sharp sometim take tri get alexa perform commandbut get know system better im hope improv one drawback music notic lot song year past rerecord origin artistbut origin record exampl secret agent man johnni riversa livevers use origin version im go pay prime musicid like hear origin version songsnot later record least give choic want hear otherwis pleas echo show pleas fact bought second one
5,30-Jul-18,Black  Show,"""I like everything, about this ! Im still learning how to use it!""",1.0,like everyth im still learn use
2,29-Jul-18,Black  Show,"""It's like having another kid in the house; I have to constantly repeat myself.I can tell Alexa to do something clear as day, and according to the history, she hears something comeletely different.The device is really cool, and I like the concept, which is why it gets two stars. However, it just doesn't work as intended.I find myself irritated more often than not when I use this device.""",0.0,like anoth kid hous constantli repeat myselfi tell alexa someth clear day accord histori hear someth comelet differentth devic realli cool like concept get two star howev doesnt work intendedi find irrit often use devic
5,29-Jul-18,White  Show,Really easy to use,1.0,realli easi use
5,29-Jul-18,White  Show,It's great sound and video quality,1.0,great sound video qualiti
1,29-Jul-18,Black  Show,The way the music sounds is poor quality,0.0,way music sound poor qualiti
4,29-Jul-18,Black  Show,"""It does everything the Echo does, and more. Although I haven't and probably won't use the video functions. I had hoped that the display would be allow for more customization. It does not and is very limited. I would like the clock and weather to display in large text all of the time, it only displays in very small text. It also always has a line that says &#34;Tell Alexa to do this, or that&#34;, tips at the bottom of the screen. I would like to see that go away, but it won't. Sound quality is good, not as good as the big Echo, but good enough. I bought it on sale and think I got value for what I paid. I would have been disappointment had I of paid full price.""",1.0,everyth echo although havent probabl wont use video function hope display would allow custom limit would like clock weather display larg text time display small text also alway line say tell alexa tip bottom screen would like see go away wont sound qualiti good good big echo good enough bought sale think got valu paid would disappoint paid full price
5,29-Jul-18,Black  Show,Love my echo show!,1.0,love echo show
4,29-Jul-18,Black  Show,I enjoy this thing. Its learning,1.0,enjoy thing learn
5,29-Jul-18,Black  Show,Am very happy now that i can see.,1.0,happi see
2,29-Jul-18,Black  Show,All of my echo devices stopped communicating properly with Sonos devices upon connecting the echo show to my account. Asking any echo device to play music on Sonos baffled the system that had previously worked flawlessly. This went on for two weeks until I eventually solved the problem that neither Amazon nor Sonos could figure out.,0.0,echo devic stop commun properli sono devic upon connect echo show account ask echo devic play music sono baffl system previous work flawlessli went two week eventu solv problem neither amazon sono could figur
5,29-Jul-18,White  Show,"""So far, I like it.  It is better than I expecting it.""",1.0,far like better expect
4,29-Jul-18,Black  Show,Doesn't always respond to the wake word. This is my 3rd echo product and I have to say I am A little disappointed. Alexa voice assistant is great when it comes to controlling a connected home but has a lot to learn from google assistant when it comes to  getting answers for search queries.,1.0,doesnt alway respond wake word rd echo product say littl disappoint alexa voic assist great come control connect home lot learn googl assist come get answer search queri
4,29-Jul-18,Black  Show,Good product.,1.0,good product
1,29-Jul-18,Black  Show,It f****** sucks,0.0,f suck
5,29-Jul-18,White  Show, ,1.0,
5,29-Jul-18,White  Show,Love being able to read the lyrics of my favorite songs.,1.0,love abl read lyric favorit song
5,29-Jul-18,Black  Show,"""This thing is awesome for grocery lists, paired with the AnyList app. The flash briefing is very good too. My only complaint is that once you pause something, Alexa decides that you no longer want to listen to that thing. Forever. All in all, definitely worth the purchase.""",1.0,thing awesom groceri list pair anylist app flash brief good complaint paus someth alexa decid longer want listen thing forev definit worth purchas
5,29-Jul-18,Black  Show,"""Works great, video call function nice when communicating through drop-in""",1.0,work great video call function nice commun dropin
5,29-Jul-18,Black  Show, ,1.0,
5,29-Jul-18,Black  Show,As you can see Echo Show is in kitchen. It far exceeds my expectation. There’s a wealth of information about any topic. If is customizable for sound and video. I also have Echo and Echo Dot. You can group them and have hole house music. Still not done exploring all it can do love it. Perfect for getting recipes so you can see them while you’re preparing to cook.,1.0,see echo show kitchen far exce expect there wealth inform topic customiz sound video also echo echo dot group hole hous music still done explor love perfect get recip see your prepar cook
4,29-Jul-18,Black  Show,Fairly easy to use,1.0,fairli easi use
5,29-Jul-18,Black  Show,Absolutely LOVE my Echo Show!  It is awesome and works great with my Ring Video Spotlight Cams!  Music on demand and so many more features that I have yet to explore!!!,1.0,absolut love echo show awesom work great ring video spotlight cam music demand mani featur yet explor
5,29-Jul-18,White  Show,Absolutely love it! I use it for everything!I tell my friends and clients that it’s the daughter I never had. I ask her to do something and she doesn’t complain! I wish I bought the 2package deal :( I truly needed one in my work room. I kick myself for it.,1.0,absolut love use everythingi tell friend client daughter never ask someth doesnt complain wish bought packag deal truli need one work room kick
5,29-Jul-18,White  Show,"""We love having this in our kitchen! Very convenient to look up recipes, listen to the news, or watch prime video while I'm cooking""",1.0,love kitchen conveni look recip listen news watch prime video im cook
1,29-Jul-18,White  Show,"""Always wanted one,till I got one, it's not at all what it's cracked up to be, it's hard to navigate I actually like the dot better.""",0.0,alway want onetil got one crack hard navig actual like dot better
5,29-Jul-18,Black  Show,The greatest,1.0,greatest
5,29-Jul-18,Black  Show,Love it,1.0,love
5,29-Jul-18,Black  Show,This is my fourth Echo (original and two dots). It's the best.... Decent speaker... Fun graphics...,1.0,fourth echo origin two dot best decent speaker fun graphic
5,29-Jul-18,Black  Show,I loved talking it out of the box and being able to easily set up.,1.0,love talk box abl easili set
5,29-Jul-18,Black  Show,Easy to setup and use. The ability to play video is huge addition on Alexa device family,1.0,easi setup use abil play video huge addit alexa devic famili
2,29-Jul-18,Black  Show,"""Echo Show is said to work with certain apps but,NOT!!! Cozi state works with Echo Show, but the Cozi Family’s doesn’t very well, Amazon needs to go back to drawing board, it would be such a needed piece of technology, but it lacks the essential, please fix. Cost of the Echo Show was  marvelous . Got Echo Show to take on shopping list but that is all so far, adding items to list has long lag, and it not my router being slow, my provider speed is !GB, speed not a problem, but before new items is updated on Cozi is very slow. Help is needed to get it updated to A1 working conditioning.""",0.0,echo show said work certain app butnot cozi state work echo show cozi famili doesnt well amazon need go back draw board would need piec technolog lack essenti pleas fix cost echo show marvel got echo show take shop list far ad item list long lag router slow provid speed gb speed problem new item updat cozi slow help need get updat work condit
4,29-Jul-18,Black  Show,"""All the music I can listen too, Also the movie I can watch I can see my ring doorbell .""",1.0,music listen also movi watch see ring doorbel
5,29-Jul-18,Black  Show,No enough video options,1.0,enough video option
4,29-Jul-18,White  Show,Great sound,1.0,great sound
4,29-Jul-18,Black  Show,I took advantage of prime Friday and decided to take a chance and purchase one.  I enjoy the features it comes with. I'm sorry I didn't purchase two of them  Well worth the money.  Its looks great on my nightstand.  Every night it puts me to steep with sleeping music.  Happy customer!,1.0,took advantag prime friday decid take chanc purchas one enjoy featur come im sorri didnt purchas two well worth money look great nightstand everi night put steep sleep music happi custom
5,29-Jul-18,Black  Show,The music...the shopping list and the sound....,1.0,musicth shop list sound
5,29-Jul-18,Black  Show,"""diversity, so many things to see and hear. Wealth of information""",1.0,divers mani thing see hear wealth inform
5,29-Jul-18,Black  Show,Love it. Thanks Amazon. You guys rock!!,1.0,love thank amazon guy rock
2,29-Jul-18,Black  Show,"""Disappointed that this device Is not able to access youtube as of Dec 2017. I wasn’t aware of that when I purchased it. I’ve had problems with my device. The voice stops working throughout the day. I can see it trying to respond to me, because the window it opens contains the info I asked about, but it’s like the device gets stuck in the process. It stops working, and the blue bar just flashes. I keep having to unplug and restart the device. Once I do that, it starts working again. So irritating. This device could really be a great device if Google and Amazon would act like grownups...""",0.0,disappoint devic abl access youtub dec wasnt awar purchas ive problem devic voic stop work throughout day see tri respond window open contain info ask like devic get stuck process stop work blue bar flash keep unplug restart devic start work irrit devic could realli great devic googl amazon would act like grownup
1,29-Jul-18,Black  Show,Returned from repair with No repair done. It has a problem which requires it to be on for a while for the defective part to show itself.I sent it for repair and got it back without being fixed.  The site gives no option to complain from the page.I have a echo spot which works perfectly in the same position.,0.0,return repair repair done problem requir defect part show itselfi sent repair got back without fix site give option complain pagei echo spot work perfectli posit
5,29-Jul-18,Black  Show,Love it!,1.0,love
5,29-Jul-18,Black  Show,I like the design and the visuals!,1.0,like design visual
5,29-Jul-18,Black  Show,"""I haven't had my show very long or used it a lot, but I love it! I use it to set timers when cooking because my stove is being finicky and not wanting to work most of the time. I also use it to check for different recipes, listen to music and my all time favorite.... telling everyone it is time for dinner. My son gets a real kick out of that!I know a lot of people are expecting more out of their shows then it is possible to at the moment, but remember the original echo didn't have what it has now when it first came out. I see that Amazon is adding new stuff all the time and soon I am sure it will have all that we want very soon.... maybe even things we haven't thought of!I do wish it was a bit more user friendly. I still haven't figured out how to video chat with my cousin in North Carolina who also has one, and when I tried to call my son's dot it went to video chat immediately, last I looked, dots don't have video screens!Another thing that needs to be addressed is when my husband tried to have the one in our bedroom play thunderstorm sounds to help him go to sleep, it tried to get him to buy an app instead of playing the skill I had enabled that was free. So now he is a bit worried to use it again. That needs to be fixed.I do have to say that all in all I am very happy with my Echo Show!""",1.0,havent show long use lot love use set timer cook stove finicki want work time also use check differ recip listen music time favorit tell everyon time dinner son get real kick thati know lot peopl expect show possibl moment rememb origin echo didnt first came see amazon ad new stuff time soon sure want soon mayb even thing havent thought ofi wish bit user friendli still havent figur video chat cousin north carolina also one tri call son dot went video chat immedi last look dot dont video screensanoth thing need address husband tri one bedroom play thunderstorm sound help go sleep tri get buy app instead play skill enabl free bit worri use need fixedi say happi echo show
5,29-Jul-18,White  Show,I have not had it very long. It's my first Alexa thing. I sure like what I have done with it so far there is a lot to learn and play with,1.0,long first alexa thing sure like done far lot learn play
5,29-Jul-18,Black  Show,Works great and has been fun to use.,1.0,work great fun use
5,29-Jul-18,White  Show,This is the best of my echo devices and I own a spot a dot and echo,1.0,best echo devic spot dot echo
4,29-Jul-18,Black  Show,Having the large screen really majes this an enjoyable experience. Only thing it’s missing is youtube.,1.0,larg screen realli maje enjoy experi thing miss youtub
5,29-Jul-18,Black  Show,easy to use.,1.0,easi use
1,29-Jul-18,Black  Show,"""Great device, features are awesome, the interaction is fantastic. Home automation works perfect if you link up your accounts correctly. My only issue is out of (4) Echo Shows (2) of them have been sent off for repair because of the screen glitching!! These are less than 3 months old and already having issues!First repairs were sent off and they “updated the firmware” when I got the device back nothing worked, I had to update to the newest firmware for it to work again. Then (2) weeks later the glitch starts up again!I love the show but I’m getting really frustrated with the glitching.""",0.0,great devic featur awesom interact fantast home autom work perfect link account correctli issu echo show sent repair screen glitch less month old alreadi issuesfirst repair sent updat firmwar got devic back noth work updat newest firmwar work week later glitch start againi love show im get realli frustrat glitch
5,29-Jul-18,Black  Show,Super fun !! I ty is what I was expecting,1.0,super fun ty expect
5,29-Jul-18,Black  Show, ,1.0,
5,29-Jul-18,White  Show,I love this so much!! Alexa is even better when she can show you things!,1.0,love much alexa even better show thing
5,29-Jul-18,Black  Show,I have the echo but got 2 show. 1 for my Daughter. Absolutely love it. Especially for the video chat.,1.0,echo got show daughter absolut love especi video chat
5,29-Jul-18,Black  Show,"""I've had an Alexa Dot for some time but I'm really enjoying the Alexa Show. It's great to have a visual whether it's a song or the weather. Played Jeapordy, but I'm not good at it. You do learn trivia and no one's watching! Love that recipes are visible and movies are available. Haven't had it long enough to try everything.""",1.0,ive alexa dot time im realli enjoy alexa show great visual whether song weather play jeapordi im good learn trivia one watch love recip visibl movi avail havent long enough tri everyth
5,29-Jul-18,Black  Show,Got this on Amazon prime with the ring pro. Work really great. Being the lazy guy I am I don't need to go see who at my door anymore while I'm gaming.,1.0,got amazon prime ring pro work realli great lazi guy dont need go see door anymor im game
5,29-Jul-18,Black  Show,"""We originally got the Show to video chat family members, and it works great for that. We have found that we really like checking things hands-free like the weather and recipes. So far we have really liked the Show, and would recommend it!""",1.0,origin got show video chat famili member work great found realli like check thing handsfre like weather recip far realli like show would recommend
5,29-Jul-18,Black  Show,Easy setup. Was up and running in minutes. The learning feature is outstanding. Now I know why Amazon is so far ahead of the competition.,1.0,easi setup run minut learn featur outstand know amazon far ahead competit
1,29-Jul-18,Black  Show,"""I bought this product hoping that Alexa would be pretty well developed and far enough along, therefore expecting her to be responsive. This $100 piece of crap doesnt even know how to respond to a question that amazon themselves told me to ask her. (Echo buttons manual, see Step 3.) The device has potential given it has a big screen, decent sound but for 200 bucks, I would never reccomend it. Even for the $100 I spent, I feel like I got shorted. Oh and lastly, the device is pretty useless without a prime membership. I linked my personal account to it and the thing was literally a decorated bluetooth speaker. I went on the family account (this one) and got it to work minimal. Oh, and even with our prime membership, you have to have a music pass or something that's an extra 3.99 a month, leaving this item a subscription nightmare, and a overpriced, decorated bluetooth speaker in my eyes. I would give it zero stars if I could.""",0.0,bought product hope alexa would pretti well develop far enough along therefor expect respons piec crap doesnt even know respond question amazon told ask echo button manual see step devic potenti given big screen decent sound buck would never reccomend even spent feel like got short oh lastli devic pretti useless without prime membership link person account thing liter decor bluetooth speaker went famili account one got work minim oh even prime membership music pass someth that extra month leav item subscript nightmar overpr decor bluetooth speaker eye would give zero star could
5,29-Jul-18,White  Show,"""quite nice...clear, great sound.""",1.0,quit niceclear great sound
5,29-Jul-18,Black  Show,"""Versatile use, can watch movies or news.  Able to use as remote for vehicle.  Or use as a communication hub for the home.  Great produc!!!""",1.0,versatil use watch movi news abl use remot vehicl use commun hub home great produc
5,29-Jul-18,Black  Show,I bought two.  One for me and one for my daughter who lives in another state.  We love it!!,1.0,bought two one one daughter live anoth state love
1,29-Jul-18,White  Show,"""Our family bought several of these to help communicate with older parents and grandparents who need simpler devices than a full-fledged tablet.  What fantastic potential these have - for digital photo screen, video calls, easy accesss to music, audio books, etc. However, once we have them setup, we discovered the huge lurking negative.  Amazon forces you to view continous spam on the home screen promoting all their Alexa features.  You can turn off many other things in settins, but you cannot turn off &#34;Things to Try&#34;.  Instead of a beautiful digital photo screen with weather and time ... we now constantly have a spam ad across the home screen that says, &#34;Try ......&#34;.  AMAZON, please listen to your customers and offer a setting to turn off this SPAM!""",0.0,famili bought sever help commun older parent grandpar need simpler devic fullfledg tablet fantast potenti digit photo screen video call easi accesss music audio book etc howev setup discov huge lurk neg amazon forc view contin spam home screen promot alexa featur turn mani thing settin cannot turn thing tri instead beauti digit photo screen weather time constantli spam ad across home screen say tri amazon pleas listen custom offer set turn spam
5,29-Jul-18,Black  Show,The best part about owning this is that my mother who is anti-technology uses this with ease everyday and finds new reasons to use it as well. Well done.,1.0,best part own mother antitechnolog use eas everyday find new reason use well well done
4,29-Jul-18,Black  Show,"""It’s my second one, so I put this one in the kitchen for recipes.""",1.0,second one put one kitchen recip
5,29-Jul-18,White  Show,Echo Show is perfect for staging in the kitchen so recipes are right there. No need to print them. Wonderful device. Acoustical sounds are not as powerful as our tall cylindercal echo but we have that covered in the adjacent family room.,1.0,echo show perfect stage kitchen recip right need print wonder devic acoust sound power tall cylinderc echo cover adjac famili room
4,29-Jul-18,Black  Show,"""Great fun but frustrating at times. Commands between tv and the show get mixed (asking to watch something will turn my directv, not display on show which stinks with an 8 year old) Also would like more video options with flash briefings. Still really a tech wonder for a low price.""",1.0,great fun frustrat time command tv show get mix ask watch someth turn directv display show stink year old also would like video option flash brief still realli tech wonder low price
5,29-Jul-18,Black  Show,Love that you can play music and see the lyrics.  Connected to my echo dot I enjoy listening in multiple rooms.,1.0,love play music see lyric connect echo dot enjoy listen multipl room
5,29-Jul-18,White  Show,Purchased as a more &#34;personal&#34; contact vehicle for engaging with long distance grandchildren. Works perfectly in every regard. Resolution and sound both better than expected. Highly recommend.,1.0,purchas person contact vehicl engag long distanc grandchildren work perfectli everi regard resolut sound better expect highli recommend
4,29-Jul-18,Black  Show,"""Works well, pictures awesome! Sound could be better. Must be on the same bandwidth as other Alexa devices for whole home music. 2.4ghz vs 5ghz.""",1.0,work well pictur awesom sound could better must bandwidth alexa devic whole home music ghz vs ghz
5,29-Jul-18,Black  Show,"""I am pleased with the Echo Show, from the sound of the music and the words to the tunes to the news and weather. The color on the screen for my photos could be better.""",1.0,pleas echo show sound music word tune news weather color screen photo could better
5,29-Jul-18,White  Show,Echo Show is my personal assistant! Awesome!!!,1.0,echo show person assist awesom
5,29-Jul-18,Black  Show,"""The packaging was beautiful and then there she was!! We have 2 dots and an echo plus already. Now we have the show and we love it. An echo for each room!You can also say &#34;Alexa, turn off the screen&#34; and it will go black. This is good for sleeping.""",1.0,packag beauti dot echo plu alreadi show love echo roomyou also say alexa turn screen go black good sleep
5,29-Jul-18,White  Show,"""My daughter has an Echo Show and she told me how much she loved it. I bought a white one for my kitchen and absolutely love it!  It has all the features of the others plus great extras. The sound system is awesome. I also own the original Echo Tower, Dots and Spot. Each are great and have their uses around my house. I highly recommend all of these products.""",1.0,daughter echo show told much love bought white one kitchen absolut love featur other plu great extra sound system awesom also origin echo tower dot spot great use around hous highli recommend product
5,29-Jul-18,Black  Show,Really like the show me feature. I also like video calls with others.,1.0,realli like show featur also like video call other
