rating,date,variation,verified_reviews,feedback,processed_reviews
5,31-Jul-18,Charcoal Fabric ,Love my Echo!,1.0,love echo
5,31-Jul-18,Charcoal Fabric ,Loved it!,1.0,love
4,31-Jul-18,Walnut Finish ,"""Sometimes while playing a game, you can answer a question correctly but Alexa says you got it wrong and answers the same as you.  I like being able to turn lights on and off while away from home.""",1.0,sometim play game answer question correctli alexa say got wrong answer like abl turn light away home
5,31-Jul-18,Charcoal Fabric ,"""I have had a lot of fun with this thing. My 4 yr old learns about dinosaurs, i control the lights and play games like categories. Has nice sound when playing music as well.""",1.0,lot fun thing yr old learn dinosaur control light play game like categori nice sound play music well
5,31-Jul-18,Charcoal Fabric ,Music,1.0,music
5,31-Jul-18,Heather Gray Fabric ,"""I received the echo as a gift. I needed another Bluetooth or something to play music easily accessible, and found this smart speaker. Can’t wait to see what else it can do.""",1.0,receiv echo gift need anoth bluetooth someth play music easili access found smart speaker cant wait see els
5,31-Jul-18,Charcoal Fabric ,I think this is the 5th one I've purchased. I'm working on getting one in every room of my house. I really like what features they offer specifily playing music on all Echos and controlling the lights throughout my house.,1.0,think th one ive purchas im work get one everi room hous realli like featur offer specifili play music echo control light throughout hous
5,30-Jul-18,Heather Gray Fabric ,looks great,1.0,look great
5,30-Jul-18,Heather Gray Fabric ,"""Love it! I’ve listened to songs I haven’t heard since childhood! I get the news, weather, information! It’s great!""",1.0,love ive listen song havent heard sinc childhood get news weather inform great
5,30-Jul-18,Charcoal Fabric ,"""I sent it to my 85 year old Dad, and he talks to it constantly.""",1.0,sent year old dad talk constantli
5,30-Jul-18,Charcoal Fabric ,I love it! Learning knew things with it eveyday! Still figuring out how everything works but so far it's been easy to use and understand. She does make me laugh at times,1.0,love learn knew thing eveyday still figur everyth work far easi use understand make laugh time
5,30-Jul-18,Oak Finish ,"""I purchased this for my mother who is having knee problems now, to give her something to do while trying to over come not getting around so fast like she did.She enjoys all the little and big things it can do...Alexa play this song, What time is it and where, and how to cook this and that!""",1.0,purchas mother knee problem give someth tri come get around fast like didsh enjoy littl big thing doalexa play song time cook
5,30-Jul-18,Charcoal Fabric ,"""Love, Love, Love!!""",1.0,love love love
5,30-Jul-18,Oak Finish ,Just what I expected....,1.0,expect
5,30-Jul-18,Heather Gray Fabric ,"""I love it, wife hates it.""",1.0,love wife hate
5,30-Jul-18,Heather Gray Fabric ,Really happy with this purchase.  Great speaker and easy to set up.,1.0,realli happi purchas great speaker easi set
5,30-Jul-18,Heather Gray Fabric ,We have only been using Alexa for a couple of days and are having a lot of fun with our new toy. It like having a new household member! We are trying to learn all the different featues and benefits that come with it.,1.0,use alexa coupl day lot fun new toy like new household member tri learn differ featu benefit come
5,30-Jul-18,Charcoal Fabric ,We love the size of the 2nd generation echo. Still needs a little improvement on sound,1.0,love size nd gener echo still need littl improv sound
4,30-Jul-18,Sandstone Fabric ,"""I liked the original Echo. This is the same but shorter and with greater fabric/color choices. I miss the volume ring on top, now it's just the plus/minus buttons. Not a big deal but the ring w as comforting. :) Other than that, well I do like the use of a standard USB charger /port instead of the previous round pin. Other than that, I guess it sounds the same, seems to work the same, still answers to Alexa/Echo/Computer. So what's not to like? :)""",1.0,like origin echo shorter greater fabriccolor choic miss volum ring top plusminu button big deal ring w comfort well like use standard usb charger port instead previou round pin guess sound seem work still answer alexaechocomput what like
5,30-Jul-18,Charcoal Fabric ,Love the Echo and how good the music sounds playing off it. Alexa understands most commands but it is difficult at times for her to find specific playlists or songs on Spotify. She is good with Amazon Music but is lacking in other major programs.,1.0,love echo good music sound play alexa understand command difficult time find specif playlist song spotifi good amazon music lack major program
5,30-Jul-18,Charcoal Fabric ,"""We love Alexa! We use her to play music, play radio through iTunes, play podcasts through Anypod, and set reminders. We listen to our flash briefing of news and weather every morning. We rely on our custom lists. We like being able to voice control the volume. We're sure we'll continue to find new uses.Sometimes it's a bit frustrating when Alexa doesn't understand what we're saying.""",1.0,love alexa use play music play radio itun play podcast anypod set remind listen flash brief news weather everi morn reli custom list like abl voic control volum sure well continu find new usessometim bit frustrat alexa doesnt understand say
4,30-Jul-18,Heather Gray Fabric ,"""Have only had it set up for a few days. Still adding smart home devices to it. The speaker is great for playing music. I like the size, we have it stationed on the kitchen counter and it’s not intrusive to look at.""",1.0,set day still ad smart home devic speaker great play music like size station kitchen counter intrus look
5,30-Jul-18,Charcoal Fabric ,I love it. It plays my sleep sounds immediately when I ask,1.0,love play sleep sound immedi ask
5,30-Jul-18,Sandstone Fabric ,Amazing product,1.0,amaz product
5,30-Jul-18,Charcoal Fabric ,"""I love my Echo. It's easy to operate, loads of fun.It is everything as advertised. I use it mainly to play my favorite tunes and test Alexa's knowledge.""",1.0,love echo easi oper load funit everyth advertis use mainli play favorit tune test alexa knowledg
5,30-Jul-18,Charcoal Fabric ,Sounds great!! Love them!,1.0,sound great love
4,30-Jul-18,Charcoal Fabric ,"""Fun item to play with and get used to using.  Sometimes has hard time answering the questions you ask, but I think it will be better.""",1.0,fun item play get use use sometim hard time answer question ask think better
5,30-Jul-18,Charcoal Fabric ,Just like the other one,1.0,like one
5,30-Jul-18,Sandstone Fabric ,Still learning all the capabilities...but so far pretty pretty pretty good,1.0,still learn capabilitiesbut far pretti pretti pretti good
4,30-Jul-18,Charcoal Fabric ,I like it,1.0,like
5,30-Jul-18,Sandstone Fabric ,"""She works well. Needs a learning command  for unique, owners and users like. Alexa “learn” Tasha’s birthday.  Or Alexa “learn” my definition of Fine. Etc. other than that she is great""",1.0,work well need learn command uniqu owner user like alexa learn tasha birthday alexa learn definit fine etc great
5,30-Jul-18,Charcoal Fabric ,This device is awesome!,1.0,devic awesom
5,30-Jul-18,Charcoal Fabric ,I bought this to compare the speaker quality to our first generation speaker and i like the sound better.  I will ship this to my daughter though because I like the fact that my first generation has a chargeable base that we bought which keeps it more mobile and she needs a better sound than what she has now.,1.0,bought compar speaker qualiti first gener speaker like sound better ship daughter though like fact first gener chargeabl base bought keep mobil need better sound
5,30-Jul-18,Sandstone Fabric ,"""Love my Echo. Still learning all the things it will do. Wasn’t able to follow instructions included in the package, but found a great one on U-Tube.""",1.0,love echo still learn thing wasnt abl follow instruct includ packag found great one utub
4,30-Jul-18,Heather Gray Fabric ,Speaker is better than 1st generation Echo,1.0,speaker better st gener echo
5,30-Jul-18,Charcoal Fabric ,"""This thing is way cool!  You should get one.  If you want to be cool, that is.""",1.0,thing way cool get one want cool
5,30-Jul-18,Heather Gray Fabric ,"""This is my first digital assistant so I'm giving this a good review. Speaker is really good for the cheap price on Prime day. Fun to play with and can be used as an alarm clock (That's what I was going to get in the first place, but I ended up with Echo). If you haven't had a go with one then definitely try it!What I like best is the number of other devices that it can connect with. My purchase came with a Smart Plug for $10 which I connect my lamp to. Alexa, turn of the lights!""",1.0,first digit assist im give good review speaker realli good cheap price prime day fun play use alarm clock that go get first place end echo havent go one definit tri itwhat like best number devic connect purchas came smart plug connect lamp alexa turn light
5,30-Jul-18,Charcoal Fabric ,My husband likes being able to use it to listen to music.  I wish we knew all it's capabilities,1.0,husband like abl use listen music wish knew capabl
5,30-Jul-18,Charcoal Fabric ,"""My Android would not allow Alexa to connect. Fortunately, my sister was here with her Apple cell. After an hour+ tech support fixed the glitches. We are up and running.""",1.0,android would allow alexa connect fortun sister appl cell hour tech support fix glitch run
4,30-Jul-18,Charcoal Fabric ,So far so good,1.0,far good
5,30-Jul-18,Charcoal Fabric ,Tried to play certain broadway shows like Camelot and it gives ne the group Camelot.,1.0,tri play certain broadway show like camelot give ne group camelot
5,30-Jul-18,Sandstone Fabric ,Great,1.0,great
5,30-Jul-18,Walnut Finish ,Very satisfied with the Echo. Alexa now controls the lights in my family room and my wife can listen to Jimmy Buffet by just asking Alexa.,1.0,satisfi echo alexa control light famili room wife listen jimmi buffet ask alexa
2,30-Jul-18,Charcoal Fabric ,"""It's like Siri, in fact, Siri answers more accurately then Alexa.  I don't see a real need for it in my household, though it was a good bargain on prime day deals.""",0.0,like siri fact siri answer accur alexa dont see real need household though good bargain prime day deal
5,30-Jul-18,Charcoal Fabric ,Love my Echo. Still learning how every thing works but having tons of fun.,1.0,love echo still learn everi thing work ton fun
5,30-Jul-18,Heather Gray Fabric ,I love you so much,1.0,love much
5,30-Jul-18,Charcoal Fabric ,"""Excelente, lo unico es que no esta en español.""",1.0,excelent lo unico es que esta en espaol
5,30-Jul-18,Charcoal Fabric ,"""I'm still learning how to use it, but so far my Echo is great! The sound is actually much better than I was expecting.""",1.0,im still learn use far echo great sound actual much better expect
5,30-Jul-18,Charcoal Fabric ,Works as you’d expect and then some. Also good sound quality considering price (70.00 on sale) and features.,1.0,work youd expect also good sound qualiti consid price sale featur
5,30-Jul-18,Charcoal Fabric ,The sound from this Echo 2nd Generation is phenomenal!  Not to mention that I just love Alexa!  She is very helpful.,1.0,sound echo nd gener phenomen mention love alexa help
5,30-Jul-18,Charcoal Fabric ,Just had to have it and now lets play and learn how to get the most out of it.,1.0,let play learn get
5,30-Jul-18,Charcoal Fabric ,Works as advertised. Very easy to setup. Still learning what this can do.,1.0,work advertis easi setup still learn
4,30-Jul-18,Charcoal Fabric ,Great sound and easy to set up.,1.0,great sound easi set
5,30-Jul-18,Oak Finish ,"""Love Alexa, bought others for friends""",1.0,love alexa bought other friend
5,30-Jul-18,Charcoal Fabric ,Love the echo I purchased it for company for my husband he is 83 and Alexa is great all he has to do is say her name and she tells him a joke and plays his favorite songs,1.0,love echo purchas compani husband alexa great say name tell joke play favorit song
5,30-Jul-18,Heather Gray Fabric ,😍,1.0,
5,30-Jul-18,Charcoal Fabric ,Love being able to listen to music easily. Still learning all the features available,1.0,love abl listen music easili still learn featur avail
4,30-Jul-18,Heather Gray Fabric ,"""Did t really know what I could use this device for. Used it for a few things, but need an overview""",1.0,realli know could use devic use thing need overview
5,30-Jul-18,Heather Gray Fabric ,Love this just wish it had a built in hub,1.0,love wish built hub
5,30-Jul-18,Charcoal Fabric ,I use it primarily to play music.  It works wonderfully!  Still getting used to some of the many things it will do.  Amazon has sent several tips since I got it. Thanks for all your help!,1.0,use primarili play music work wonder still get use mani thing amazon sent sever tip sinc got thank help
5,30-Jul-18,Charcoal Fabric ,How easy if was to set up.,1.0,easi set
4,30-Jul-18,Charcoal Fabric ,Fast response which was amazing.  Clear concise answers and sound quality is fantastic.  I am still getting used to Alexia and have not usde Echo to its full extent.,1.0,fast respons amaz clear concis answer sound qualiti fantast still get use alexia usd echo full extent
5,30-Jul-18,Charcoal Fabric ,You’re all I need...na na nana!,1.0,your needna na nana
5,30-Jul-18,Charcoal Fabric ,Does everything as expected and more.,1.0,everyth expect
5,30-Jul-18,Sandstone Fabric ,"""I love my Echo!  Works just like they said it would. I don't have a &#34;smart&#34; home, so I cannot speak about that function, but everything else about it is good.""",1.0,love echo work like said would dont smart home cannot speak function everyth els good
5,30-Jul-18,Charcoal Fabric ,Great sound in a small package—easy to set up and use; fun to own.,1.0,great sound small packageeasi set use fun
5,30-Jul-18,Charcoal Fabric ,Works and sounds great.,1.0,work sound great
5,30-Jul-18,Heather Gray Fabric ,The sound is amazing and many collections of all music,1.0,sound amaz mani collect music
4,30-Jul-18,Sandstone Fabric ,Setting up,1.0,set
5,30-Jul-18,Heather Gray Fabric ,She doesn’t always listen,1.0,doesnt alway listen
5,30-Jul-18,Charcoal Fabric ,It’s awesome,1.0,awesom
4,30-Jul-18,Heather Gray Fabric ,"""I bought this because it can control fios television. It works well. I’m hoping over time it will do more to control fios. Then I discovered all the other things Alexa can do. Play music you ask for. Great sound from Alexa. Play games. Play radio stations. Play old time radio programs like the Long Ranger. Alexa has many “apps” you can add to her abilities. The other day I played Madlibs. Great fun. Also Alexa can control household appliances. I just purchased Alexa compatible power strips to control lighting, fans and TV components. I’m looking forward to implementing this controll. You can also add other Alexa components to have chosen music to play in all rooms where the components are located.""",1.0,bought control fio televis work well im hope time control fio discov thing alexa play music ask great sound alexa play game play radio station play old time radio program like long ranger alexa mani app add abil day play madlib great fun also alexa control household applianc purchas alexa compat power strip control light fan tv compon im look forward implement control also add alexa compon chosen music play room compon locat
5,30-Jul-18,Heather Gray Fabric ,The speaker has excellent sound and works perfectly!,1.0,speaker excel sound work perfectli
5,30-Jul-18,Charcoal Fabric ,I LIKE IT ALL,1.0,like
5,30-Jul-18,Charcoal Fabric ,I love it. It does everything,1.0,love everyth
5,30-Jul-18,Heather Gray Fabric ,I was a little nervous when I received my new Echo as I'm not really Tech savvy. I found it a bit intimidating at first but it didn't take me to long to figure it out!! I'm very happy with my purchase and now thinking of adding an echo spot!!!,1.0,littl nervou receiv new echo im realli tech savvi found bit intimid first didnt take long figur im happi purchas think ad echo spot
4,30-Jul-18,Charcoal Fabric ,I like it and still learning how to use it.,1.0,like still learn use
5,30-Jul-18,Charcoal Fabric ,Great technology!! Can't believe the speaker volume and quality is so wonderful. Wish I had bought another one!,1.0,great technolog cant believ speaker volum qualiti wonder wish bought anoth one
5,30-Jul-18,Heather Gray Fabric ,"""I purchased an echo dot for my husband for Fathers Day.  He uses it constantly and after hearing the quality of sound of the Echo (2nd Generation), It was a no-brainer.  Best gift ever!""",1.0,purchas echo dot husband father day use constantli hear qualiti sound echo nd gener nobrain best gift ever
4,30-Jul-18,Charcoal Fabric ,Works fine!!,1.0,work fine
5,30-Jul-18,Heather Gray Fabric , ,1.0,
5,30-Jul-18,Charcoal Fabric ,Clear music,1.0,clear music
5,30-Jul-18,Charcoal Fabric ,"""Fun to use, good sound quality""",1.0,fun use good sound qualiti
5,30-Jul-18,Sandstone Fabric ,The echo works well. I was able to sync it with my other Amazon music devices.,1.0,echo work well abl sync amazon music devic
5,30-Jul-18,Charcoal Fabric ,"""Works great, but I don't think Amazon should charge another cent for unlimited music when you 1) Have Prime AND 2) Buy an Echo.""",1.0,work great dont think amazon charg anoth cent unlimit music prime buy echo
5,30-Jul-18,Charcoal Fabric ,Already had an Echo Dot. The Echo is even better with fuller sound. Also during setup it now lets phone calls to be made to my contact list which is great!,1.0,alreadi echo dot echo even better fuller sound also setup let phone call made contact list great
5,30-Jul-18,Charcoal Fabric ,The speaker sounds really good,1.0,speaker sound realli good
5,30-Jul-18,Heather Gray Fabric ,Good sound works well,1.0,good sound work well
5,30-Jul-18,Charcoal Fabric ,Love it and Alexa. I am not very savvy but support was very helpful and patient.,1.0,love alexa savvi support help patient
5,30-Jul-18,Charcoal Fabric ,"""Love it! I was thinking about getting one and when the prime day discount was offered, I could not pass it up! It's fun to ask Alexa to play any song or group and she comes up with a playlist from Amazon Prime Music. You can also connect your iPhone with bluetooth and play music with Pandora or YouTube videos using Alexa as a speaker. I've been having fun asking Alexa different types of questions or for information like weather, news or even the time in other countries. The only downside is if you have limited data on your wifi plan, because Alexa uses burns it up when playing music.""",1.0,love think get one prime day discount offer could pass fun ask alexa play song group come playlist amazon prime music also connect iphon bluetooth play music pandora youtub video use alexa speaker ive fun ask alexa differ type question inform like weather news even time countri downsid limit data wifi plan alexa use burn play music
5,30-Jul-18,Charcoal Fabric ,"""We like it all so far, but have a lot to try out yet.""",1.0,like far lot tri yet
5,30-Jul-18,Heather Gray Fabric ,Love it - am using it strictly for music now and it's great!,1.0,love use strictli music great
5,30-Jul-18,Sandstone Fabric ,"""Love the Echo !!! I love the size, material and speaker quality. I have it hooked up to one light easily and will work on additional lights and thermostat. Next is Echo Dot for bedroom. There is a lot more to do with Echo that you think. Traffic, Weather, Trivia, etc.""",1.0,love echo love size materi speaker qualiti hook one light easili work addit light thermostat next echo dot bedroom lot echo think traffic weather trivia etc
4,30-Jul-18,Charcoal Fabric ,Love it!,1.0,love
5,30-Jul-18,Charcoal Fabric ,The entire family loves Alexa Echo. She’s now a part of this family.,1.0,entir famili love alexa echo she part famili
5,30-Jul-18,Walnut Finish ,"""Great fun getting to know all the functions of this product.  WOW -- family fun and homework help.  Talking with other grandchildren,who also have an Echo, is a HUGE bonus.  Can't wait to learn more and more and more""",1.0,great fun get know function product wow famili fun homework help talk grandchildrenwho also echo huge bonu cant wait learn
5,30-Jul-18,Heather Gray Fabric ,Love it!,1.0,love
5,30-Jul-18,Heather Gray Fabric ,"""awesome thing, love Alexa""",1.0,awesom thing love alexa
5,30-Jul-18,Charcoal Fabric ,It worked exactly as expected and the speaker has great sound. It is perfect for my classroom!,1.0,work exactli expect speaker great sound perfect classroom
5,30-Jul-18,Charcoal Fabric ,"""LOVE, LOVE this new little gadget.  Has  made our lives so much easier.  it's like having our own personal secretary living here in the home.  We hardly need our CD's anymore, since ALEXA plays everything we need.  Going to get the Alexa DOTS soon for more rooms.  Thanks!!""",1.0,love love new littl gadget made live much easier like person secretari live home hardli need cd anymor sinc alexa play everyth need go get alexa dot soon room thank
4,30-Jul-18,Heather Gray Fabric ,The speaker is of surprising quality. Happy with the purchase.,1.0,speaker surpris qualiti happi purchas
5,30-Jul-18,Charcoal Fabric ,Very easy to set up. Works wonderful and I love it!!,1.0,easi set work wonder love
5,30-Jul-18,Sandstone Fabric ,I'm really impressed with the sound quality when playing music from this device.  The bass sounds almost like it's coming from a bigger speaker so props to Amazon.,1.0,im realli impress sound qualiti play music devic bass sound almost like come bigger speaker prop amazon
4,30-Jul-18,Charcoal Fabric ,"""It’s still a great product.But the sound quality does seem worse.Don’t get me wrong. You definitely get used to it within an hour. But it definitely feels like echo gen 1 sound quality was better.Besides that , it’s great.With the addition of being able to play Just over Bluetooth with no WiFi, it’s even better.""",1.0,still great productbut sound qualiti seem worsedont get wrong definit get use within hour definit feel like echo gen sound qualiti betterbesid greatwith addit abl play bluetooth wifi even better
4,30-Jul-18,Sandstone Fabric ,The outlet does not work with it. Was disappointed in that.,1.0,outlet work disappoint
4,30-Jul-18,Charcoal Fabric ,"""Great device, responsive and helpful""",1.0,great devic respons help
2,30-Jul-18,Charcoal Fabric ,Sound is terrible if u want good music too get a bose,0.0,sound terribl u want good music get bose
4,30-Jul-18,Charcoal Fabric ,"""i liked the sound . what is troubling is that I paid extra money to have access to a million more songs. Sometimes it doesn't work. Ex. Alexa play Italian songs&#34; .don't have or don&#34; t understand. or play the opera Tosca, response &#34;sorry I don&#34;t have that.""",1.0,like sound troubl paid extra money access million song sometim doesnt work ex alexa play italian song dont understand play opera tosca respons sorri dont
5,30-Jul-18,Charcoal Fabric ,Easy to set up and use. Too bad it has to be plugged in. Would be nice to take it outside and operate on battery and recharged.,1.0,easi set use bad plug would nice take outsid oper batteri recharg
5,30-Jul-18,Charcoal Fabric ,Still learning all the ways to use it.  It is a real hit with my grandkids who ask it to play music and then dance to it.  (5 and 7 yrs).  Very cute.,1.0,still learn way use real hit grandkid ask play music danc yr cute
4,30-Jul-18,Oak Finish ,"""4.5 out of 5 Stars. I generally like this product. Its great at doing what you ask of it like playing music, setting timers, and making calls. Reason why I didn't rate it 5 out of 5 is that sometimes the connection dies and my Echo stops playing music and shows a red ring. Seems to be a connection issue. Overall, great product.""",1.0,star gener like product great ask like play music set timer make call reason didnt rate sometim connect die echo stop play music show red ring seem connect issu overal great product
5,30-Jul-18,Charcoal Fabric ,"""Works great, upgraded from echo dot to full size echo, couldn’t be happier!""",1.0,work great upgrad echo dot full size echo couldnt happier
5,30-Jul-18,Charcoal Fabric ,It's Alexa.... what else can you say,1.0,alexa els say
5,30-Jul-18,Charcoal Fabric ,Upgraded from my lilttle echo dot. Happy with sound,1.0,upgrad lilttl echo dot happi sound
4,30-Jul-18,Sandstone Fabric ,"""Excellent product, set up with ease as well.""",1.0,excel product set eas well
5,30-Jul-18,Heather Gray Fabric ,I've had the first gen Echo since it first came out and it has worked well for me. I purchased the 2nd gen during Prime Day and so far I'm happy. It seems to have an improved speaker which provides enhanced sound for music and such.,1.0,ive first gen echo sinc first came work well purchas nd gen prime day far im happi seem improv speaker provid enhanc sound music
5,30-Jul-18,Charcoal Fabric ,I love my Echo smart speaker.  I love the volume and clarity.  It was easy to set up.  ITs a wonderful gift for any age.,1.0,love echo smart speaker love volum clariti easi set wonder gift age
5,30-Jul-18,Charcoal Fabric ,wonderful product and fast delivery!,1.0,wonder product fast deliveri
4,30-Jul-18,Charcoal Fabric ,Initially harder to set up called tech wasn’t that knowledgeable now working great.,1.0,initi harder set call tech wasnt knowledg work great
5,30-Jul-18,Heather Gray Fabric ,It was very easy to set up and my family love it’s!,1.0,easi set famili love
5,30-Jul-18,Charcoal Fabric ,Has great sound and is very responsive my voice and commands.,1.0,great sound respons voic command
