rating,date,variation,verified_reviews,feedback,processed_reviews
2,29-Jul-18,Charcoal Fabric ,"""Really disappointed Alexa has to be plug-in to wall socket all the time.  My fault for not checking this, but made the assumption that a company has technologically advanced as Amazon would sell this product with a rechargeable battery.  If I could return it, I would as my Apple music and boom speaker give me more flexibility the Alexa.""",0.0,realli disappoint alexa plugin wall socket time fault check made assumpt compani technolog advanc amazon would sell product recharg batteri could return would appl music boom speaker give flexibl alexa
5,29-Jul-18,Charcoal Fabric ,Everything,1.0,everyth
5,29-Jul-18,Charcoal Fabric ,Supberb sound! Definitely worth the extra money if you listen to lots of music.,1.0,supberb sound definit worth extra money listen lot music
5,29-Jul-18,Charcoal Fabric ,I really love my amazon echo. I think the sound quality is great and we have a lot of fun with it. It is really handy for music and to get updates on the weather and sports!,1.0,realli love amazon echo think sound qualiti great lot fun realli handi music get updat weather sport
5,29-Jul-18,Charcoal Fabric ,Love it!  So do the grandkids!!,1.0,love grandkid
4,29-Jul-18,Heather Gray Fabric ,"""So far it has worked well. Not always intuitive as to how to link different devices, or """"skills"""", but getting the hang of it.""",1.0,far work well alway intuit link differ devic skill get hang
5,29-Jul-18,Charcoal Fabric ,Works as advertised,1.0,work advertis
5,29-Jul-18,Sandstone Fabric ,I love it!,1.0,love
4,29-Jul-18,Sandstone Fabric ,"""Love my new addition to the house! Speaker quality is great and over all we love our Alexa. My only two ( not complaints, more suggestions for the future series) would be better communication ability. Example: For our smart lights in the house. Unless we specify kitchen Light 1 or kitchen Light 2 prior to the command she either won’t respond or says she doesn’t recognize. It may be me, but I want my Alexa to respond when I say thank you afterwards. I have to repeat Alexa thank you and there are times she won’t respond to me, but will my husband. I know it sounds odd. We laugh about it, but maybe it’s a Southern thing but I want my Alexa to have manners too.""",1.0,love new addit hous speaker qualiti great love alexa two complaint suggest futur seri would better commun abil exampl smart light hous unless specifi kitchen light kitchen light prior command either wont respond say doesnt recogn may want alexa respond say thank afterward repeat alexa thank time wont respond husband know sound odd laugh mayb southern thing want alexa manner
5,29-Jul-18,Sandstone Fabric ,"""Like everything about it. The music, the trivia games, the weather.""",1.0,like everyth music trivia game weather
5,29-Jul-18,Charcoal Fabric ,As described and received on time.  Do not like automatic enrolment into music.,1.0,describ receiv time like automat enrol music
5,29-Jul-18,Charcoal Fabric ,A great device,1.0,great devic
5,29-Jul-18,Charcoal Fabric ,Love this!  Have it in the kitchen and works well!,1.0,love kitchen work well
5,29-Jul-18,Charcoal Fabric ,Very nice!  I'm impressed - wish she had more to say though.,1.0,nice im impress wish say though
5,29-Jul-18,Charcoal Fabric ,Love the product. Nice to have easy access to so much info!!!,1.0,love product nice easi access much info
2,29-Jul-18,Sandstone Fabric ,It's got great sound and bass but it doesn't work all of the time. Its still hot or miss when it recognizes things,0.0,got great sound bass doesnt work time still hot miss recogn thing
4,29-Jul-18,Charcoal Fabric ,We are still discovering all that the Echo can do.,1.0,still discov echo
5,29-Jul-18,Charcoal Fabric ,Amazing paroduct,1.0,amaz paroduct
4,29-Jul-18,Heather Gray Fabric ,Good hearing range and sound quality. It was a bit complicated to set up and she doesn't quite understand me a lot even when I am speaking slowly and clearly but I love the flash briefing feature and interfacing with my abode home security system.,1.0,good hear rang sound qualiti bit complic set doesnt quit understand lot even speak slowli clearli love flash brief featur interfac abod home secur system
4,29-Jul-18,Charcoal Fabric ,speaker sounds good,1.0,speaker sound good
5,29-Jul-18,Charcoal Fabric ,Absolutely love!!,1.0,absolut love
5,29-Jul-18,Charcoal Fabric ,The best part of this product is you can control the thermostat and lights for your house.  There isn’t anything I dislike.,1.0,best part product control thermostat light hous isnt anyth dislik
5,29-Jul-18,Charcoal Fabric ,We're thoroughly enjoying our Amazon Echo. Installation was easy using the Alexa app. I purchased 2 Kasa smart plugs to control our living room lights. Installation again was easy using the Kasa app. They sinqued right up with the Echo. We're enjoying playing music with the Echo and the sound quality is awesome. We've added a Kasa smart bulb for our kitchen. Setup was seamless. We're looking forward to adding more automation to our home.,1.0,thoroughli enjoy amazon echo instal easi use alexa app purchas kasa smart plug control live room light instal easi use kasa app sinqu right echo enjoy play music echo sound qualiti awesom weve ad kasa smart bulb kitchen setup seamless look forward ad autom home
5,29-Jul-18,Charcoal Fabric ,Home entertainment,1.0,home entertain
4,29-Jul-18,Heather Gray Fabric ,"""Very cool product. Easy to setup, fun to use and sound quality is much better than I anticipated.""",1.0,cool product easi setup fun use sound qualiti much better anticip
5,29-Jul-18,Heather Gray Fabric ,"""Love these,  great sound... easy to connect and use...""",1.0,love great sound easi connect use
5,29-Jul-18,Charcoal Fabric ,"""Doesn't work with my fairly new smart TV, but that's mainly the TV manufacturers(LG) fault due to not supporting anything older than TVs from this year. My smart locks also need an additional piece of equipment in order to connect as well. Speakers sound great and works very well.""",1.0,doesnt work fairli new smart tv that mainli tv manufacturerslg fault due support anyth older tv year smart lock also need addit piec equip order connect well speaker sound great work well
5,29-Jul-18,Charcoal Fabric ,Great sound from a little speaker,1.0,great sound littl speaker
5,29-Jul-18,Charcoal Fabric ,We enjoy it,1.0,enjoy
5,29-Jul-18,Sandstone Fabric , ,1.0,
5,29-Jul-18,Heather Gray Fabric ,Cool,1.0,cool
4,29-Jul-18,Charcoal Fabric ,"""Good quality, great sound quality""",1.0,good qualiti great sound qualiti
5,29-Jul-18,Charcoal Fabric ,Works perfectly,1.0,work perfectli
4,29-Jul-18,Heather Gray Fabric ,"""Great product. Sometimes Alexa does not understand some commands for my Fire TV. All in all, this is a fabulous speaker.""",1.0,great product sometim alexa understand command fire tv fabul speaker
4,29-Jul-18,Charcoal Fabric ,Love my Echo great sound very smart!,1.0,love echo great sound smart
5,29-Jul-18,Heather Gray Fabric ,Sure did !! Love it !!,1.0,sure love
5,29-Jul-18,Charcoal Fabric ,plays great,1.0,play great
5,29-Jul-18,Charcoal Fabric ,Works absolutely great,1.0,work absolut great
5,29-Jul-18,Charcoal Fabric ,Very amazing product. Great sound quality.,1.0,amaz product great sound qualiti
5,29-Jul-18,Charcoal Fabric ,Best thing I've invested in in a while thank you so much 😁😁😁😁,1.0,best thing ive invest thank much
5,29-Jul-18,Charcoal Fabric ,"""I am extremely impressed with this item. Bought it from the &#34;warehouse&#34; or &#34;outlet&#34; with a &#34;minor imperfection. Can't tell it even has one. works great. Didn't come in packaging, but it was sealed up and had no damage and wasn't missing anything. I like the sound quality, I see some knock it. It's not a BOSE but it's more than great for our family. Easy to use, minor learning curve as it learns your voice. It integrates seamlessly with my other amazon services.Can't wait to get for my classroom too! It's a lot of fun even just as a speaker, let alone what I plan to do with it.""",1.0,extrem impress item bought warehous outlet minor imperfect cant tell even one work great didnt come packag seal damag wasnt miss anyth like sound qualiti see knock bose great famili easi use minor learn curv learn voic integr seamlessli amazon servicesc wait get classroom lot fun even speaker let alon plan
5,29-Jul-18,Sandstone Fabric ,"""I love my Echo show!  and now i have this in my bedroom and it's wonderful!, music, info, sleeping sounds!""",1.0,love echo show bedroom wonder music info sleep sound
5,29-Jul-18,Sandstone Fabric ,"""Awesome life changer! Seriously, I am able to start my morning with Alexa, by having her &#34;wake&#34;me up with  her alarm and then playing me some music. She has gotten used to my voice, that I can be in another room and she will &#34;listen&#34; to what I say. I love both my echos!!! Don't hesitate, get one and for the price, the speaker is unbelievable. I am buying the cordless holder, so I can take the echo anywhere. Love my purchase and love alexa!!!!""",1.0,awesom life changer serious abl start morn alexa wakem alarm play music gotten use voic anoth room listen say love echo dont hesit get one price speaker unbeliev buy cordless holder take echo anywher love purchas love alexa
2,29-Jul-18,Sandstone Fabric ,"""I am not super impressed with Alexa. When my Prime lapsed, she wouldn't play anything. She isn't smart enough to differentiate among spotify accounts so we can't use it for that either. She randomly speaks up when nobody is talking to her. Just today I unplugged her...not sure I'll ever use my Alexa again.""",0.0,super impress alexa prime laps wouldnt play anyth isnt smart enough differenti among spotifi account cant use either randomli speak nobodi talk today unplug hernot sure ill ever use alexa
5,29-Jul-18,Charcoal Fabric ,I like everything about it !!!,1.0,like everyth
5,29-Jul-18,Heather Gray Fabric ,Liked 100%,1.0,like
5,29-Jul-18,Charcoal Fabric ,Never had ANY issue with buying use electronics as long as I get the GOOD or LIKE NEW. Just read the comment to see why it is used.,1.0,never issu buy use electron long get good like new read comment see use
5,29-Jul-18,Charcoal Fabric ,Our family really loves this new Echo,1.0,famili realli love new echo
5,29-Jul-18,Heather Gray Fabric ,bought for my wife she loves it,1.0,bought wife love
5,29-Jul-18,Charcoal Fabric ,Fun just got it today now my I pod will go in my car and I will use this is the house.,1.0,fun got today pod go car use hous
4,29-Jul-18,Sandstone Fabric ,Like it to do more,1.0,like
5,29-Jul-18,Sandstone Fabric ,"""This is our third echo. Worth every penny. It's like having 3 household employees for a small flat rate. We keep them in the bedrooms and the living room. We can drop-in and use them as an intercom, listen to music, answer quick questions, alarms to wake up for school, etc.""",1.0,third echo worth everi penni like household employe small flat rate keep bedroom live room dropin use intercom listen music answer quick question alarm wake school etc
5,29-Jul-18,Charcoal Fabric ,Listen music and set timer,1.0,listen music set timer
5,29-Jul-18,Sandstone Fabric ,I received the echo in perfect condition. The device was easy to set up and responds quickly and without any issues. Alexa is a great addition to our family!,1.0,receiv echo perfect condit devic easi set respond quickli without issu alexa great addit famili
5,29-Jul-18,Charcoal Fabric ,Good sound. Like it for music and scheduling. Like that i can get random thoughts recorded while I think about them. The jokes are cute!,1.0,good sound like music schedul like get random thought record think joke cute
5,29-Jul-18,Charcoal Fabric ,Purchased this for myself and am just beginning to learn all that it can do.  So far am very pleased and amazed at the different actions it can perform.  Am enjoying it and looking forward to learning more about other options it provides.,1.0,purchas begin learn far pleas amaz differ action perform enjoy look forward learn option provid
5,29-Jul-18,Sandstone Fabric ,"""This echo is just as great as my others, even though it is smaller.""",1.0,echo great other even though smaller
5,29-Jul-18,Charcoal Fabric ,Funny how you buy something just because it looks fun and it winds up being a totally useful part of your home!!!  Loving it!!,1.0,funni buy someth look fun wind total use part home love
5,29-Jul-18,Charcoal Fabric ,"""I have had all good experience, so far with the second generation Echo. There are so many more things to learn, but I have not had the time yet. Right now, I am mostly enjoying the music, weather updates, using the alarm feature, and her personality. I have also purchased some mini smart socket yes. I am very excited to begin using them""",1.0,good experi far second gener echo mani thing learn time yet right mostli enjoy music weather updat use alarm featur person also purchas mini smart socket ye excit begin use
5,29-Jul-18,Charcoal Fabric ,"""I’m having trouble connecting my tv to it, but I’m not exactly tech smart. I’m sure one of my grandsons will figure it out for me. So far I’ve been using it mostly for music.""",1.0,im troubl connect tv im exactli tech smart im sure one grandson figur far ive use mostli music
5,29-Jul-18,Charcoal Fabric ,Simply love my Echo. I hardly watch any TV at all anymore. I'm too busy listening to music. Speaker is pretty goo for its size. All the fun skills really make the echo fun for my whole family.,1.0,simpli love echo hardli watch tv anymor im busi listen music speaker pretti goo size fun skill realli make echo fun whole famili
5,29-Jul-18,Charcoal Fabric ,Enjoyed entire echo experience,1.0,enjoy entir echo experi
4,29-Jul-18,Charcoal Fabric ,Easy to set up.,1.0,easi set
4,29-Jul-18,Charcoal Fabric ,"""The Echo is an amazing device.  Many times it seems very intuitive.  But at other times I ask for something that seems clear and simple and get no result.  Installation was fairly straightforward, but I messed up several times simply because I thought a step was complete when it wasn't.  This actually made me lose ground until I figured that out.  My advice is to be patient; the app will let you know when you can move on to the next step.My biggest issue of the moment is that we have several Echo devices in our home and I would like to use them as intercoms (which I am told can be done).  However, I can't make any of the Echos aware of the others existence.  When I ask Alexa how to do this she answers about instructions how to change her name.  I know this is likely my fault, but I would think the designers would anticipate this and make it easier to find the needed instructions.  A small deal for many device savvy people, but a challenge for me.""",1.0,echo amaz devic mani time seem intuit time ask someth seem clear simpl get result instal fairli straightforward mess sever time simpli thought step complet wasnt actual made lose ground figur advic patient app let know move next stepmi biggest issu moment sever echo devic home would like use intercom told done howev cant make echo awar other exist ask alexa answer instruct chang name know like fault would think design would anticip make easier find need instruct small deal mani devic savvi peopl challeng
5,29-Jul-18,Heather Gray Fabric ,We are loving Ours very much,1.0,love much
5,29-Jul-18,Heather Gray Fabric ,"""I have the original Alexa and the Tap and so far the 2nd generation is the best. I'm happy to see they are making improvements with each new one.It would be great to have updates to our little A.I.'s, I think it would help out a lot with the bugs in it. All in all I am very happy with her and I can now play music throughout the whole house and adjust the bass and treble. Thank you""",1.0,origin alexa tap far nd gener best im happi see make improv new oneit would great updat littl ai think would help lot bug happi play music throughout whole hous adjust bass trebl thank
5,29-Jul-18,Charcoal Fabric ,"""Very pleased with the Echo 2nd Generation. It is so nice to have Alexa available for music, weather, news, and probably a lot more we haven’t discovered.""",1.0,pleas echo nd gener nice alexa avail music weather news probabl lot havent discov
4,29-Jul-18,Heather Gray Fabric ,"""I am pleasantly surprised by the sound quality of the Echo. If you are a big fan of deep bass, this might not be sufficient for you though. The potential to control your home is an option I will explore more as I evolve my home into a """"smart home"""". The voice recognition is very impressive. It is stylish and fun. I have no regrets with this purchase. It is great for technically changes people. Ask it to play a song or a movie and it responds instantly. If you have an elderly loved one, this would be a great gift. Once connected to wifi, it is very simple to use.  If you want unlimited music control, be sure to have amazon prime or premium spotify and you will be blown away with your personal dj! You can even have conversations with the echo. I am not embarrassed to say, that echo has made me laugh a couple times when I ask it to tell me a joke. It tells me where my packages are since I am an amazon prime addict, it comes in extremely  handy!""",1.0,pleasantli surpris sound qualiti echo big fan deep bass might suffici though potenti control home option explor evolv home smart home voic recognit impress stylish fun regret purchas great technic chang peopl ask play song movi respond instantli elderli love one would great gift connect wifi simpl use want unlimit music control sure amazon prime premium spotifi blown away person dj even convers echo embarrass say echo made laugh coupl time ask tell joke tell packag sinc amazon prime addict come extrem handi
5,29-Jul-18,Heather Gray Fabric ,Easy to setup. Love all the things she does.,1.0,easi setup love thing
5,29-Jul-18,Heather Gray Fabric ,Have Alexa throughout the house----the future has arrived!,1.0,alexa throughout houseth futur arriv
5,29-Jul-18,Charcoal Fabric ,"""I already have an Alexa and with Amazon find today I could not resist getting an echo also. It is the best thing I ever did, I use them on each side of the house! And couldn't be happier!""",1.0,alreadi alexa amazon find today could resist get echo also best thing ever use side hous couldnt happier
5,29-Jul-18,Sandstone Fabric ,Arrived as expected.,1.0,arriv expect
5,29-Jul-18,Charcoal Fabric ,"""Bought this a few weeks ago -  everything about this product is excellent !!!!! Don't forget to buy a charger when ordering, it's a must have to take outside by the pool and not have to worry about hiring an electrician to put in outlets all over the yard.""",1.0,bought week ago everyth product excel dont forget buy charger order must take outsid pool worri hire electrician put outlet yard
4,29-Jul-18,Charcoal Fabric ,Terrific,1.0,terrif
5,29-Jul-18,Oak Finish ,Love my Echo,1.0,love echo
5,29-Jul-18,Charcoal Fabric ,It’s smaller than the original. Looks nicer too.,1.0,smaller origin look nicer
5,29-Jul-18,Heather Gray Fabric ,Works great!,1.0,work great
5,29-Jul-18,Charcoal Fabric ,"""My husband and I are what I would call &#34;late adopters&#34; when it come to technology, but we decide we would try and Echo to serve primarily as a music source.  Wow, were we amazed and the great sound!  We've also been having a great time listening to all of our favorite songs buy just asking Alexa.  I may even buy one for my elderly Dad - I think he will enjoy having one to listen to music or even place his calls to us!""",1.0,husband would call late adopt come technolog decid would tri echo serv primarili music sourc wow amaz great sound weve also great time listen favorit song buy ask alexa may even buy one elderli dad think enjoy one listen music even place call us
5,29-Jul-18,Charcoal Fabric ,"""I really have enjoyed it.  Changing the Directv channels, plays iHeartRadio and Pandora , adjusts the ac thermostat and turns the living room lights and outside lights.""",1.0,realli enjoy chang directv channel play iheartradio pandora adjust ac thermostat turn live room light outsid light
5,29-Jul-18,Charcoal Fabric ,I have been wanting one of these for a while now.  Bought on Prime Day and absolutely love it.,1.0,want one bought prime day absolut love
5,29-Jul-18,Charcoal Fabric ,We are so glad that we got the Echo over a Bluetooth speaker. Alexa does so much more stuff than other non smart speakers out there. I personally love the timer feature. It has helped me with cooking multiple things simultaneously. Pandora integration is another feature that I use daily. So happy with out Prime Day purchase. I will get the Echo hub and a few more Echo dots in the future.,1.0,glad got echo bluetooth speaker alexa much stuff non smart speaker person love timer featur help cook multipl thing simultan pandora integr anoth featur use daili happi prime day purchas get echo hub echo dot futur
5,29-Jul-18,Charcoal Fabric ,See subject line.  Love it,1.0,see subject line love
5,29-Jul-18,Heather Gray Fabric ,Love it!,1.0,love
5,29-Jul-18,Heather Gray Fabric ,Very easy setup.,1.0,easi setup
5,29-Jul-18,Heather Gray Fabric ,"""I was hesitant to buy the echo because I have the echo Dot and it seems good enough. The echo is the same except the sound quality, which I really didn't feel I needed. However, I am so glad I got it. What a difference! The sound really is far superior to the Echo Dot! Now I can listen to The Greatest Showman with a little more power!""",1.0,hesit buy echo echo dot seem good enough echo except sound qualiti realli didnt feel need howev glad got differ sound realli far superior echo dot listen greatest showman littl power
5,29-Jul-18,Sandstone Fabric ,Sound quality is great. Still learning about all the different things I can do with it. FUN!!!,1.0,sound qualiti great still learn differ thing fun
5,29-Jul-18,Charcoal Fabric ,Got a good deal and works great with Prime.  Setup was a bit of a pain but more the fault of crappy internet service.  Has worked great with nice sound from small speaker.,1.0,got good deal work great prime setup bit pain fault crappi internet servic work great nice sound small speaker
5,29-Jul-18,Charcoal Fabric ,I love it!!,1.0,love
5,29-Jul-18,Charcoal Fabric ,Works great! Perfect for my office!,1.0,work great perfect offic
5,29-Jul-18,Heather Gray Fabric ,Love it--- have one inside house and one by our pool now . Just as good as Bose speakers around house -,1.0,love one insid hous one pool good bose speaker around hous
5,29-Jul-18,Sandstone Fabric ,easy to use--amazing,1.0,easi useamaz
5,29-Jul-18,Charcoal Fabric ,Nice product A+,1.0,nice product
5,29-Jul-18,Charcoal Fabric ,We love our Echo! We were totally amazed at the speaker quality. Only bummed we didn’t buy two since we got it on Prime day!,1.0,love echo total amaz speaker qualiti bum didnt buy two sinc got prime day
5,29-Jul-18,Sandstone Fabric ,Very responsive. Great sound quality for its size.,1.0,respons great sound qualiti size
5,29-Jul-18,Charcoal Fabric ,It's so efficient and amazing!  How COOL!  We all use it often every day...,1.0,effici amaz cool use often everi day
4,29-Jul-18,Charcoal Fabric ,"""I’m impressed with the quality of sound that the Echo has, it’s definitely comparable to my Bose Mini. I only gave 4 stars because I can’t use my Apple Music account.""",1.0,im impress qualiti sound echo definit compar bose mini gave star cant use appl music account
5,29-Jul-18,Charcoal Fabric ,Technology in such a small device. The price was good too! The sound is amazing! A must have feature for any home!,1.0,technolog small devic price good sound amaz must featur home
5,29-Jul-18,Charcoal Fabric ,Mainly use it for the music but I’m learning more all the time.  Really nothing bad to say about it,1.0,mainli use music im learn time realli noth bad say
5,29-Jul-18,Charcoal Fabric ,"""I replaced my 1st gen, was concerned about a smaller unit not having the same sound...I was wrong.  If anything it's the same volume, and more clear.  Good product.""",1.0,replac st gen concern smaller unit soundi wrong anyth volum clear good product
5,29-Jul-18,Charcoal Fabric ,Great addition to my Echo Plus!,1.0,great addit echo plu
5,29-Jul-18,Charcoal Fabric ,the best,1.0,best
5,29-Jul-18,Heather Gray Fabric ,Love the feature to play music in every room with multiple Echos.,1.0,love featur play music everi room multipl echo
5,29-Jul-18,Heather Gray Fabric ,I love Alexa!  I am surprised how much I use her.,1.0,love alexa surpris much use
5,29-Jul-18,Charcoal Fabric ,I use this product for enjoyment and I just love it,1.0,use product enjoy love
5,29-Jul-18,Sandstone Fabric ,Easy to use and has great sound...It was a great purchase at a great price.,1.0,easi use great soundit great purchas great price
5,29-Jul-18,Charcoal Fabric ,Very easy to set up and have no issues.,1.0,easi set issu
5,29-Jul-18,Charcoal Fabric ,This unit add much pleasure to our Echo Plus.  We now can have music and information through our home. (or just in one room),1.0,unit add much pleasur echo plu music inform home one room
4,29-Jul-18,Heather Gray Fabric ,It's extremely useful in simple things like spotify and audible and things like that but sometimes it doesn't answer everything I ask but it's still nice to use.,1.0,extrem use simpl thing like spotifi audibl thing like sometim doesnt answer everyth ask still nice use
2,29-Jul-18,Charcoal Fabric ,Too difficult to set up.  It keeps timing out before you can enter the password,0.0,difficult set keep time enter password
5,29-Jul-18,Charcoal Fabric ,"""Just getting use to using the Echo. Used it for shopping lists, listening to music and as a timer. Working great so far.""",1.0,get use use echo use shop list listen music timer work great far
